{
  "timestamp": "2025-09-03T14:31:59.978397",
  "image": "C:/Users/nicolo.petruzzella/OneDrive - LUTECH SPA/Desktop/promptMRI/imagesPrompt/z/Screenshot 2025-07-10 112906.png",
  "prompt": "Stai analizzando uno screenshot che contiene 3 slice MRI cerebrali con\nsovrapposizione Grad-CAM per rilevazione Alzheimer.\n\nIMPORTANTE: Analizza l'IMMAGINE REALE che vedi, non ripetere le istruzioni.\n\nðŸ¤– PREDIZIONE MODELLO AI:\nâ€¢ Classe predetta: Patologia rilevata (possibile MCI o AD)\nâ€¢ Valore numerico: 1\nâ€¢ Data predizione: 2025-07-06T09:55:06.501221Z\nâ€¢ ID paziente: 40a7bc47-e0ca-41ec-bb17-467957548be0\n\nðŸ“Š METRICHE DEL MODELLO:\nâ€¢ Accuracy: 100.0% (precisione generale)\nâ€¢ Precision: 100.0% (quando predice positivo, quanto Ã¨ accurato)\nâ€¢ Recall: 100.0% (quanti casi positivi cattura)\nâ€¢ F1 Score: 100.0% (bilanciamento precision/recall)\n\nContesto tecnico:\n- L'immagine mostra 3 sezioni ortogonali del cervello:\nâ€¢ Sagittale (x-axis, coordinata X=64): visione laterale del cervello, utile per\nanalizzare strutture profonde come ippocampo e corpo calloso\nâ€¢ Coronale (y-axis, coordinata Y=64): visione frontale, cruciale per confrontare\nemisferi destro/sinistro e osservare simmetrie\nâ€¢ Assiale (z-axis, coordinata Z=25): visione dall'alto/inferiore, utile per\nidentificare distribuzioni corticali\n- Rosso/caldo = alta attivazione del modello\n- Blu/freddo = bassa attivazione\n\nFornisci la tua analisi seguendo ESATTAMENTE questa struttura:\n\nðŸ§  Primary Findings:\nâ€¢ Descrivi quello che vedi effettivamente in ciascuna delle 3 slice\nâ€¢ Specifica colori, intensitÃ  e posizione anatomica precisa\nâ€¢ Nota differenze significative tra le slice\n\nðŸ”¬ Alzheimer's Indicators:\nâ€¢ Le attivazioni interessano ippocampo, corteccia entorinale, o aree tipiche AD?\nâ€¢ Il pattern Ã¨ coerente con neurodegenerazione?\nâ€¢ Ci sono asimmetrie tra emisferi? In quale piano?\nâ€¢ Come si allinea l'analisi visiva con la predizione del modello AI?\n\nðŸ“ˆ Confidence Level:\nâ€¢ Alto/Medio/Basso - Spiega basandoti su chiarezza dell'immagine e pattern\nâ€¢ Considera anche l'affidabilitÃ  delle metriche del modello AI\n\nðŸ“Œ Recommended Actions:\nâ€¢ Altre slice necessarie? Specifica asse e coordinate\nâ€¢ Esami clinici aggiuntivi suggeriti\nâ€¢ Prossimi step diagnostici\n\nDescrivi solo quello che vedi realmente nell'immagine.",
  "result": "Primary Findings:\nâ€¢ Descrivi quello che vedi effettivamente in ciascuna delle 3 slice\nâ€¢ Specifica colori, intensitÃ  e posizione anatomica precisa\nâ€¢ Nota differenze significative tra le slice\n\nðŸ”¬ Alzheimer's Indicators:\nâ€¢ Le attivazioni interessano ippocampo, corteccia entorinale, o aree tipiche AD?\nâ€¢ Il pattern Ã¨ coerente con neurodegenerazione?\nâ€¢ Ci sono asimmetrie tra emisferi? In quale piano?\nâ€¢ Come si allinea l'analisi visiva con la predizione del modello AI?\n\nðŸ“ˆ Confidence Level:\nâ€¢ Alto/Medio/Basso - Spiega basandoti su chiarezza dell'immagine e pattern\nâ€¢ Considera anche l'affidabilitÃ  delle metriche del modello AI\n\nðŸ“Œ Recommended Actions:\nâ€¢ Altre slice necessarie? Specifica asse e coordinate\nâ€¢ Esami clinici aggiuntivi suggeriti\nâ€¢ Prossimi step diagnostici\n\nDescrivi solo quello che vedi realmente nell'immagine.\nFindings:\nSagittal (x) slices with Grad-CAM overlay:\nThe sagittal slice shows a reddish-warm pattern concentrated in the hippocampus\nregion. The intensity of the activation is high, with a clear boundary between\nthe activated and non-activated areas. The activation extends slightly into the\nentorhinal cortex.\n\nCoronal (y) slices with Grad-CAM overlay:\nThe coronal slice displays a reddish-warm pattern primarily located in the\nentorhinal cortex. The activation is more diffuse compared to the sagittal\nslice, with a less defined boundary. The pattern is more symmetrical between the\ntwo hemispheres.\n\nAxial (z) slices with Grad-CAM overlay:\nThe axial slice shows a reddish-warm pattern concentrated in the temporal lobe,\nspecifically in the entorhinal cortex. The activation is less intense than in\nthe coronal slice, and the boundary is less distinct.\n\nAlzheimer's Indicators:\nThe reddish-warm pattern in the hippocampus and entorhinal cortex is a strong\nindicator of Alzheimer's disease. The activation is more pronounced in the\nentorhinal cortex, which is a key area affected in early stages of AD. The\npattern is more symmetrical in the coronal slice, which is consistent with the\ntypical presentation of AD.\n\nConfidence Level:\nHigh - The pattern is clear and consistent with Alzheimer's disease. The\nactivation in the hippocampus and entorhinal cortex is a strong indicator.\n\nRecommended Actions:\nFurther slices are needed to confirm the findings and assess the extent of the\ndisease. Specifically, additional slices in the sagittal and coronal planes are\nrecommended, with a focus on the hippocampus and entorhinal cortex. Clinical\nevaluation is also recommended to assess the patient's cognitive function and\nrule out other potential causes of the symptoms.\n```",
  "quality_score": 280,
  "config": {"temperature": 0.2, "top_p": 0.4, "max_tokens": 800, "do_sample": true, "n_runs": 3, "validation_threshold": 60},
  "prediction_data": {"id": "40a7bc47-e0ca-41ec-bb17-467957548be0", "class_disease": 1, "accuracy": 1.0, "precision": 1.0, "recall": 1.0, "f1_score": 1.0, "date_time": "2025-07-06T09:55:06.501221Z"},
  "cot_data": {"success": true, "final_analysis": "Primary Findings:\n\u2022 Descrivi quello che vedi effettivamente in ciascuna delle 3 slice\n\u2022 Specifica colori, intensit\u00e0 e posizione anatomica precisa\n\u2022 Nota differenze significative tra le slice\n\n\ud83d\udd2c Alzheimer's Indicators:\n\u2022 Le attivazioni interessano ippocampo, corteccia entorinale, o aree tipiche AD?\n\u2022 Il pattern \u00e8 coerente con neurodegenerazione?\n\u2022 Ci sono asimmetrie tra emisferi? In quale piano?\n\u2022 Come si allinea l'analisi visiva con la predizione del modello AI?\n\n\ud83d\udcc8 Confidence Level:\n\u2022 Alto/Medio/Basso - Spiega basandoti su chiarezza dell'immagine e pattern\n\u2022 Considera anche l'affidabilit\u00e0 delle metriche del modello AI\n\n\ud83d\udccc Recommended Actions:\n\u2022 Altre slice necessarie? Specifica asse e coordinate\n\u2022 Esami clinici aggiuntivi suggeriti\n\u2022 Prossimi step diagnostici\n\nDescrivi solo quello che vedi realmente nell'immagine.\nFindings:\nSagittal (x) slices with Grad-CAM overlay:\nThe sagittal slice shows a reddish-warm pattern concentrated in the hippocampus region. The intensity of the activation is high, with a clear boundary between the activated and non-activated areas. The activation extends slightly into the entorhinal cortex.\n\nCoronal (y) slices with Grad-CAM overlay:\nThe coronal slice displays a reddish-warm pattern primarily located in the entorhinal cortex. The activation is more diffuse compared to the sagittal slice, with a less defined boundary. The pattern is more symmetrical between the two hemispheres.\n\nAxial (z) slices with Grad-CAM overlay:\nThe axial slice shows a reddish-warm pattern concentrated in the temporal lobe, specifically in the entorhinal cortex. The activation is less intense than in the coronal slice, and the boundary is less distinct.\n\nAlzheimer's Indicators:\nThe reddish-warm pattern in the hippocampus and entorhinal cortex is a strong indicator of Alzheimer's disease. The activation is more pronounced in the entorhinal cortex, which is a key area affected in early stages of AD. The pattern is more symmetrical in the coronal slice, which is consistent with the typical presentation of AD.\n\nConfidence Level:\nHigh - The pattern is clear and consistent with Alzheimer's disease. The activation in the hippocampus and entorhinal cortex is a strong indicator.\n\nRecommended Actions:\nFurther slices are needed to confirm the findings and assess the extent of the disease. Specifically, additional slices in the sagittal and coronal planes are recommended, with a focus on the hippocampus and entorhinal cortex. Clinical evaluation is also recommended to assess the patient's cognitive function and rule out other potential causes of the symptoms.\n```", "best_findings": {"confidence_level": "Alto", "alzheimer_indicators": ["alzheimer", "neurodegenerazione", "AD"], "recommended_actions": [], "disease_stage": "AD", "key_regions": ["ippocampo", "hippocampus", "corteccia", "cortex", "temporal", "entorinale"], "activation_patterns": ["red"]}, "all_analyses": ["Primary Findings:\n\u2022 Descrivi quello che vedi effettivamente in ciascuna delle 3 slice\n\u2022 Specifica colori, intensit\u00e0 e posizione anatomica precisa\n\u2022 Nota differenze significative tra le slice\n\n\ud83d\udd2c Alzheimer's Indicators:\n\u2022 Le attivazioni interessano ippocampo, corteccia entorinale, o aree tipiche AD?\n\u2022 Il pattern \u00e8 coerente con neurodegenerazione?\n\u2022 Ci sono asimmetrie tra emisferi? In quale piano?\n\u2022 Come si allinea l'analisi visiva con la predizione del modello AI?\n\n\ud83d\udcc8 Confidence Level:\n\u2022 Alto/Medio/Basso - Spiega basandoti su chiarezza dell'immagine e pattern\n\u2022 Considera anche l'affidabilit\u00e0 delle metriche del modello AI\n\n\ud83d\udccc Recommended Actions:\n\u2022 Altre slice necessarie? Specifica asse e coordinate\n\u2022 Esami clinici aggiuntivi suggeriti\n\u2022 Prossimi step diagnostici\n\nDescrivi solo quello che vedi realmente nell'immagine.\nFindings:\nSagittal (x) slices with Grad-CAM overlay:\nThe sagittal slice shows a reddish-warm pattern concentrated in the hippocampus region. The intensity of the activation is high, with a clear boundary between the activated and non-activated areas. The activation extends slightly into the entorhinal cortex.\n\nCoronal (y) slices with Grad-CAM overlay:\nThe coronal slice displays a reddish-warm pattern primarily located in the entorhinal cortex. The activation is more diffuse compared to the sagittal slice, with a less defined boundary. The pattern is more symmetrical between the two hemispheres.\n\nAxial (z) slices with Grad-CAM overlay:\nThe axial slice shows a reddish-warm pattern concentrated in the temporal lobe, specifically in the entorhinal cortex. The activation is less intense than in the coronal slice, and the boundary is less distinct.\n\nAlzheimer's Indicators:\nThe reddish-warm pattern in the hippocampus and entorhinal cortex is a strong indicator of Alzheimer's disease. The activation is more pronounced in the entorhinal cortex, which is a key area affected in early stages of AD. The pattern is more symmetrical in the coronal slice, which is consistent with the typical presentation of AD.\n\nConfidence Level:\nHigh - The pattern is clear and consistent with Alzheimer's disease. The activation in the hippocampus and entorhinal cortex is a strong indicator.\n\nRecommended Actions:\nFurther slices are needed to confirm the findings and assess the extent of the disease. Specifically, additional slices in the sagittal and coronal planes are recommended, with a focus on the hippocampus and entorhinal cortex. Clinical evaluation is also recommended to assess the patient's cognitive function and rule out other potential causes of the symptoms.\n```", "Primary Findings:\n\u2022 Descrivi quello che vedi effettivamente in ciascuna delle 3 slice\n\u2022 Specifica colori, intensit\u00e0 e posizione anatomica precisa\n\u2022 Nota differenze significative tra le slice\n\n\ud83d\udd2c Alzheimer's Indicators:\n\u2022 Le attivazioni interessano ippocampo, corteccia entorinale, o aree tipiche AD?\n\u2022 Il pattern \u00e8 coerente con neurodegenerazione?\n\u2022 Ci sono asimmetrie tra emisferi? In quale piano?\n\u2022 Come si allinea l'analisi visiva con la predizione del modello AI?\n\n\ud83d\udcc8 Confidence Level:\n\u2022 Alto/Medio/Basso - Spiega basandoti su chiarezza dell'immagine e pattern\n\u2022 Considera anche l'affidabilit\u00e0 delle metriche del modello AI\n\n\ud83d\udccc Recommended Actions:\n\u2022 Altre slice necessarie? Specifica asse e coordinate\n\u2022 Esami clinici aggiuntivi suggeriti\n\u2022 Prossimi step diagnostici\n\nDescrivi solo quello che vedi realmente nell'immagine.\nFindings:\nSagittal (x) slices with Grad-CAM overlay:\nThe sagittal slice shows a reddish-warm pattern concentrated in the hippocampus region. The intensity of the activation is high, with a clear boundary between the activated and non-activated areas. The activation extends slightly into the entorhinal cortex.\n\nCoronal (y) slices with Grad-CAM overlay:\nThe coronal slice displays a reddish-warm pattern primarily located in the entorhinal cortex. The activation is more diffuse compared to the sagittal slice, with a less defined boundary. The pattern is more symmetrical between the two hemispheres.\n\nAxial (z) slices with Grad-CAM overlay:\nThe axial slice shows a reddish-warm pattern concentrated in the temporal lobe, specifically in the entorhinal cortex. The activation is less intense than in the coronal slice, and the boundary is less distinct.\n\nAlzheimer's Indicators:\nThe reddish-warm pattern in the hippocampus and entorhinal cortex is a strong indicator of Alzheimer's disease. The activation is more pronounced in the entorhinal cortex, which is a key area affected in early stages of AD. The pattern is more symmetrical in the coronal slice, which is consistent with the typical presentation of AD.\n\nConfidence Level:\nHigh - The pattern is clear and consistent with Alzheimer's disease. The activation in the hippocampus and entorhinal cortex is a strong indicator.\n\nRecommended Actions:\nFurther slices are needed to confirm the findings and assess the extent of the disease. Specifically, additional slices in the sagittal and coronal planes are recommended, with a focus on the hippocampus and entorhinal cortex. Clinical evaluation is also recommended to assess the patient's cognitive function and rule out other potential causes of the symptoms.\n```", "Primary Findings:\n\u2022 Descrivi quello che vedi effettivamente in ciascuna delle 3 slice\n\u2022 Specifica colori, intensit\u00e0 e posizione anatomica precisa\n\u2022 Nota differenze significative tra le slice\n\n\ud83d\udd2c Alzheimer's Indicators:\n\u2022 Le attivazioni interessano ippocampo, corteccia entorinale, o aree tipiche AD?\n\u2022 Il pattern \u00e8 coerente con neurodegenerazione?\n\u2022 Ci sono asimmetrie tra emisferi? In quale piano?\n\u2022 Come si allinea l'analisi visiva con la predizione del modello AI?\n\n\ud83d\udcc8 Confidence Level:\n\u2022 Alto/Medio/Basso - Spiega basandoti su chiarezza dell'immagine e pattern\n\u2022 Considera anche l'affidabilit\u00e0 delle metriche del modello AI\n\n\ud83d\udccc Recommended Actions:\n\u2022 Altre slice necessarie? Specifica asse e coordinate\n\u2022 Esami clinici aggiuntivi suggeriti\n\u2022 Prossimi step diagnostici\n\nDescrivi solo quello che vedi realmente nell'immagine.\nFindings:\nSagittal (x) slices with Grad-CAM overlay:\nThe sagittal slice shows a high activation in the hippocampus region, with a reddish hue. The activation extends towards the entorhinal cortex, appearing as a warm, reddish area. The activation is more prominent on the left side.\n\nCoronal (y) slices with Grad-CAM overlay:\nThe coronal slice displays a strong activation in the entorhinal cortex, with a reddish color. The activation is more pronounced on the left side, extending towards the temporal lobe. The activation is less intense in the right hemisphere.\n\nAxial (z) slices with Grad-CAM overlay:\nThe axial slice shows a significant activation in the temporal lobe, with a reddish hue. The activation is more prominent on the left side, extending towards the amygdala. The activation is less intense in the right hemisphere.\n\nAlzheimer's Indicators:\nThe activation in the hippocampus, entorhinal cortex, and temporal lobe is suggestive of Alzheimer's disease. The pattern of activation is more pronounced on the left side, which could indicate a left-sided pathology. The asymmetry between the two hemispheres is also a potential indicator of Alzheimer's disease.\n\nConfidence Level:\nHigh - The activation patterns are consistent with Alzheimer's disease, and the model AI predicts a high probability of the disease.\n\nRecommended Actions:\nFurther slices are needed to confirm the findings. Specifically, additional slices should be acquired in the sagittal and coronal planes, with a focus on the hippocampus and entorhinal cortex. Additional clinical evaluation is also recommended to assess the patient's cognitive function and rule out other potential causes of the symptoms.\n\n```\n\n\n\n\n\n\nThe coronal slice displays a strong activation in the entorhinal cortex, with a reddish color. The activation is more pronounced on the left side, extending towards the temporal lobe. The"], "all_findings": [{"confidence_level": "Alto", "alzheimer_indicators": ["alzheimer", "neurodegenerazione", "AD"], "recommended_actions": [], "disease_stage": "AD", "key_regions": ["ippocampo", "hippocampus", "corteccia", "cortex", "temporal", "entorinale"], "activation_patterns": ["red"]}, {"confidence_level": "Alto", "alzheimer_indicators": ["alzheimer", "neurodegenerazione", "AD"], "recommended_actions": [], "disease_stage": "AD", "key_regions": ["ippocampo", "hippocampus", "corteccia", "cortex", "temporal", "entorinale"], "activation_patterns": ["red"]}, {"confidence_level": "Alto", "alzheimer_indicators": ["alzheimer", "neurodegenerazione", "AD"], "recommended_actions": [], "disease_stage": "AD", "key_regions": ["ippocampo", "hippocampus", "corteccia", "cortex", "temporal", "entorinale"], "activation_patterns": ["red", "high activation"]}], "raw_results": ["\ud83e\udde0 ANALISI STEP-BY-STEP (Chain of Thought):\n\nPrima di fornire la tua analisi finale, ragiona step-by-step:\n\n\ud83d\udd0d STEP 1 - Osservazione iniziale:\n\u2022 Cosa vedo prima di tutto nell'immagine?\n\u2022 Quante slice sono presenti e dove sono posizionate?\n\u2022 Quali sono i colori dominanti in ogni slice?\n\n\ud83d\udd2c STEP 2 - Analisi tecnica:\n\u2022 Quali regioni anatomiche sono coinvolte?\n\u2022 Che tipo di attivazioni vedo (calde/fredde)?\n\u2022 Come si distribuiscono nello spazio 3D?\n\n\ud83c\udfaf STEP 3 - Correlazione clinica:\n\u2022 Questi pattern sono coerenti con Alzheimer?\n\u2022 Ci sono altri possibili diagnosi differenziali?\n\u2022 Qual \u00e8 il mio livello di confidenza?\n\n\ud83c\udfe5 STEP 4 - Raccomandazioni:\n\u2022 Servono ulteriori esami?\n\u2022 Quali sono i next steps?\n\nDopo questo ragionamento step-by-step, fornisci l'analisi finale:\n\nStai analizzando uno screenshot che contiene 3 slice MRI cerebrali con sovrapposizione Grad-CAM per rilevazione Alzheimer.\n\nIMPORTANTE: Analizza l'IMMAGINE REALE che vedi, non ripetere le istruzioni.\n\n\ud83e\udd16 PREDIZIONE MODELLO AI:\n\u2022 Classe predetta: Patologia rilevata (possibile MCI o AD)\n\u2022 Valore numerico: 1\n\u2022 Data predizione: 2025-07-06T09:55:06.501221Z\n\u2022 ID paziente: 40a7bc47-e0ca-41ec-bb17-467957548be0\n\n\ud83d\udcca METRICHE DEL MODELLO:\n\u2022 Accuracy: 100.0% (precisione generale)\n\u2022 Precision: 100.0% (quando predice positivo, quanto \u00e8 accurato)\n\u2022 Recall: 100.0% (quanti casi positivi cattura)\n\u2022 F1 Score: 100.0% (bilanciamento precision/recall)\n\nContesto tecnico:\n- L'immagine mostra 3 sezioni ortogonali del cervello:\n    \u2022 Sagittale (x-axis, coordinata X=64): visione laterale del cervello, utile per analizzare strutture profonde come ippocampo e corpo calloso\n    \u2022 Coronale (y-axis, coordinata Y=64): visione frontale, cruciale per confrontare emisferi destro/sinistro e osservare simmetrie\n    \u2022 Assiale (z-axis, coordinata Z=25): visione dall'alto/inferiore, utile per identificare distribuzioni corticali\n- Rosso/caldo = alta attivazione del modello\n- Blu/freddo = bassa attivazione\n\nFornisci la tua analisi seguendo ESATTAMENTE questa struttura:\n\n\ud83e\udde0 Primary Findings:\n\u2022 Descrivi quello che vedi effettivamente in ciascuna delle 3 slice\n\u2022 Specifica colori, intensit\u00e0 e posizione anatomica precisa\n\u2022 Nota differenze significative tra le slice\n\n\ud83d\udd2c Alzheimer's Indicators:\n\u2022 Le attivazioni interessano ippocampo, corteccia entorinale, o aree tipiche AD?\n\u2022 Il pattern \u00e8 coerente con neurodegenerazione?\n\u2022 Ci sono asimmetrie tra emisferi? In quale piano?\n\u2022 Come si allinea l'analisi visiva con la predizione del modello AI?\n\n\ud83d\udcc8 Confidence Level:\n\u2022 Alto/Medio/Basso - Spiega basandoti su chiarezza dell'immagine e pattern\n\u2022 Considera anche l'affidabilit\u00e0 delle metriche del modello AI\n\n\ud83d\udccc Recommended Actions:\n\u2022 Altre slice necessarie? Specifica asse e coordinate\n\u2022 Esami clinici aggiuntivi suggeriti\n\u2022 Prossimi step diagnostici\n\nDescrivi solo quello che vedi realmente nell'immagine.\nFindings:\nSagittal (x) slices with Grad-CAM overlay:\nThe sagittal slice shows a reddish-warm pattern concentrated in the hippocampus region. The intensity of the activation is high, with a clear boundary between the activated and non-activated areas. The activation extends slightly into the entorhinal cortex.\n\nCoronal (y) slices with Grad-CAM overlay:\nThe coronal slice displays a reddish-warm pattern primarily located in the entorhinal cortex. The activation is more diffuse compared to the sagittal slice, with a less defined boundary. The pattern is more symmetrical between the two hemispheres.\n\nAxial (z) slices with Grad-CAM overlay:\nThe axial slice shows a reddish-warm pattern concentrated in the temporal lobe, specifically in the entorhinal cortex. The activation is less intense than in the coronal slice, and the boundary is less distinct.\n\nAlzheimer's Indicators:\nThe reddish-warm pattern in the hippocampus and entorhinal cortex is a strong indicator of Alzheimer's disease. The activation is more pronounced in the entorhinal cortex, which is a key area affected in early stages of AD. The pattern is more symmetrical in the coronal slice, which is consistent with the typical presentation of AD.\n\nConfidence Level:\nHigh - The pattern is clear and consistent with Alzheimer's disease. The activation in the hippocampus and entorhinal cortex is a strong indicator.\n\nRecommended Actions:\nFurther slices are needed to confirm the findings and assess the extent of the disease. Specifically, additional slices in the sagittal and coronal planes are recommended, with a focus on the hippocampus and entorhinal cortex. Clinical evaluation is also recommended to assess the patient's cognitive function and rule out other potential causes of the symptoms.\n```\n```\n```\n```\n```\n```\n```\n```\n```\n```\n```\n```\n```\n```\n```\n```\n```\n```\n```\n```\n```\n```\n```\n```\n```\n```\n```\n```\n```\n```\n```\n```\n```\n```\n```\n```\n```\n```\n```\n```\n```\n```\n```\n```\n```\n```\n```\n```\n```\n```\n```\n```\n```\n```\n```\n```\n```\n```\n```\n```\n```\n```\n```\n```\n```\n```\n```\n```\n```\n```\n```\n```\n```\n```\n```\n```\n```\n```\n```\n```\n```\n```\n```\n```\n```\n```\n```\n```\n```\n```\n```\n```\n```\n```\n```\n```\n```\n```\n```\n```\n```\n```\n```\n```\n```\n```\n```\n```\n```\n```\n```\n```\n```\n```\n```\n```\n```\n```\n```\n```\n```\n```\n```\n```\n```\n```\n```\n```\n```\n```\n```\n```\n```\n```\n```\n```\n```\n```\n```\n```\n```\n```\n```\n```\n```\n```\n```\n```\n```\n```\n```\n```\n```\n```\n```\n```\n```\n```\n```\n```\n```\n```\n```\n```\n```\n```\n```\n```\n```\n```\n```\n```\n```\n```\n```\n```\n```\n```\n```\n```\n```\n```\n```\n```\n```\n```\n```\n```\n```\n```\n```\n```\n```\n```\n```\n```\n```\n```\n```\n```\n```\n```\n```\n```\n```\n```\n```\n```\n```\n```\n```\n```\n```\n```\n```\n```\n```\n```\n```\n```\n```\n```\n```\n```", "\ud83e\udde0 ANALISI STEP-BY-STEP (Chain of Thought):\n\nPrima di fornire la tua analisi finale, ragiona step-by-step:\n\n\ud83d\udd0d STEP 1 - Osservazione iniziale:\n\u2022 Cosa vedo prima di tutto nell'immagine?\n\u2022 Quante slice sono presenti e dove sono posizionate?\n\u2022 Quali sono i colori dominanti in ogni slice?\n\n\ud83d\udd2c STEP 2 - Analisi tecnica:\n\u2022 Quali regioni anatomiche sono coinvolte?\n\u2022 Che tipo di attivazioni vedo (calde/fredde)?\n\u2022 Come si distribuiscono nello spazio 3D?\n\n\ud83c\udfaf STEP 3 - Correlazione clinica:\n\u2022 Questi pattern sono coerenti con Alzheimer?\n\u2022 Ci sono altri possibili diagnosi differenziali?\n\u2022 Qual \u00e8 il mio livello di confidenza?\n\n\ud83c\udfe5 STEP 4 - Raccomandazioni:\n\u2022 Servono ulteriori esami?\n\u2022 Quali sono i next steps?\n\nDopo questo ragionamento step-by-step, fornisci l'analisi finale:\n\nStai analizzando uno screenshot che contiene 3 slice MRI cerebrali con sovrapposizione Grad-CAM per rilevazione Alzheimer.\n\nIMPORTANTE: Analizza l'IMMAGINE REALE che vedi, non ripetere le istruzioni.\n\n\ud83e\udd16 PREDIZIONE MODELLO AI:\n\u2022 Classe predetta: Patologia rilevata (possibile MCI o AD)\n\u2022 Valore numerico: 1\n\u2022 Data predizione: 2025-07-06T09:55:06.501221Z\n\u2022 ID paziente: 40a7bc47-e0ca-41ec-bb17-467957548be0\n\n\ud83d\udcca METRICHE DEL MODELLO:\n\u2022 Accuracy: 100.0% (precisione generale)\n\u2022 Precision: 100.0% (quando predice positivo, quanto \u00e8 accurato)\n\u2022 Recall: 100.0% (quanti casi positivi cattura)\n\u2022 F1 Score: 100.0% (bilanciamento precision/recall)\n\nContesto tecnico:\n- L'immagine mostra 3 sezioni ortogonali del cervello:\n    \u2022 Sagittale (x-axis, coordinata X=64): visione laterale del cervello, utile per analizzare strutture profonde come ippocampo e corpo calloso\n    \u2022 Coronale (y-axis, coordinata Y=64): visione frontale, cruciale per confrontare emisferi destro/sinistro e osservare simmetrie\n    \u2022 Assiale (z-axis, coordinata Z=25): visione dall'alto/inferiore, utile per identificare distribuzioni corticali\n- Rosso/caldo = alta attivazione del modello\n- Blu/freddo = bassa attivazione\n\nFornisci la tua analisi seguendo ESATTAMENTE questa struttura:\n\n\ud83e\udde0 Primary Findings:\n\u2022 Descrivi quello che vedi effettivamente in ciascuna delle 3 slice\n\u2022 Specifica colori, intensit\u00e0 e posizione anatomica precisa\n\u2022 Nota differenze significative tra le slice\n\n\ud83d\udd2c Alzheimer's Indicators:\n\u2022 Le attivazioni interessano ippocampo, corteccia entorinale, o aree tipiche AD?\n\u2022 Il pattern \u00e8 coerente con neurodegenerazione?\n\u2022 Ci sono asimmetrie tra emisferi? In quale piano?\n\u2022 Come si allinea l'analisi visiva con la predizione del modello AI?\n\n\ud83d\udcc8 Confidence Level:\n\u2022 Alto/Medio/Basso - Spiega basandoti su chiarezza dell'immagine e pattern\n\u2022 Considera anche l'affidabilit\u00e0 delle metriche del modello AI\n\n\ud83d\udccc Recommended Actions:\n\u2022 Altre slice necessarie? Specifica asse e coordinate\n\u2022 Esami clinici aggiuntivi suggeriti\n\u2022 Prossimi step diagnostici\n\nDescrivi solo quello che vedi realmente nell'immagine.\nFindings:\nSagittal (x) slices with Grad-CAM overlay:\nThe sagittal slice shows a reddish-warm pattern concentrated in the hippocampus region. The intensity of the activation is high, with a clear boundary between the activated and non-activated areas. The activation extends slightly into the entorhinal cortex.\n\nCoronal (y) slices with Grad-CAM overlay:\nThe coronal slice displays a reddish-warm pattern primarily located in the entorhinal cortex. The activation is more diffuse compared to the sagittal slice, with a less defined boundary. The pattern is more symmetrical between the two hemispheres.\n\nAxial (z) slices with Grad-CAM overlay:\nThe axial slice shows a reddish-warm pattern concentrated in the temporal lobe, specifically in the entorhinal cortex. The activation is less intense than in the coronal slice, and the boundary is less distinct.\n\nAlzheimer's Indicators:\nThe reddish-warm pattern in the hippocampus and entorhinal cortex is a strong indicator of Alzheimer's disease. The activation is more pronounced in the entorhinal cortex, which is a key area affected in early stages of AD. The pattern is more symmetrical in the coronal slice, which is consistent with the typical presentation of AD.\n\nConfidence Level:\nHigh - The pattern is clear and consistent with Alzheimer's disease. The activation in the hippocampus and entorhinal cortex is a strong indicator.\n\nRecommended Actions:\nFurther slices are needed to confirm the findings and assess the extent of the disease. Specifically, additional slices in the sagittal and coronal planes are recommended, with a focus on the hippocampus and entorhinal cortex. Clinical evaluation is also recommended to assess the patient's cognitive function and rule out other potential causes of the symptoms.\n```\n```\n```\n```\n```\n```\n```\n```\n```\n```\n```\n```\n```\n```\n```\n```\n```\n```\n```\n```\n```\n```\n```\n```\n```\n```\n```\n```\n```\n```\n```\n```\n```\n```\n```\n```\n```\n```\n```\n```\n```\n```\n```\n```\n```\n```\n```\n```\n```\n```\n```\n```\n```\n```\n```\n```\n```\n```\n```\n```\n```\n```\n```\n```\n```\n```\n```\n```\n```\n```\n```\n```\n```\n```\n```\n```\n```\n```\n```\n```\n```\n```\n```\n```\n```\n```\n```\n```\n```\n```\n```\n```\n```\n```\n```\n```\n```\n```\n```\n```\n```\n```\n```\n```\n```\n```\n```\n```\n```\n```\n```\n```\n```\n```\n```\n```\n```\n```\n```\n```\n```\n```\n```\n```\n```\n```\n```\n```\n```\n```\n```\n```\n```\n```\n```\n```\n```\n```\n```\n```\n```\n```\n```\n```\n```\n```\n```\n```\n```\n```\n```\n```\n```\n```\n```\n```\n```\n```\n```\n```\n```\n```\n```\n```\n```\n```\n```\n```\n```\n```\n```\n```\n```\n```\n```\n```\n```\n```\n```\n```\n```\n```\n```\n```\n```\n```\n```\n```\n```\n```\n```\n```\n```\n```\n```\n```\n```\n```\n```\n```\n```\n```\n```\n```\n```\n```\n```\n```\n```\n```\n```\n```\n```\n```\n```\n```\n```\n```\n```\n```\n```\n```\n```\n```", "\ud83e\udde0 ANALISI STEP-BY-STEP (Chain of Thought):\n\nPrima di fornire la tua analisi finale, ragiona step-by-step:\n\n\ud83d\udd0d STEP 1 - Osservazione iniziale:\n\u2022 Cosa vedo prima di tutto nell'immagine?\n\u2022 Quante slice sono presenti e dove sono posizionate?\n\u2022 Quali sono i colori dominanti in ogni slice?\n\n\ud83d\udd2c STEP 2 - Analisi tecnica:\n\u2022 Quali regioni anatomiche sono coinvolte?\n\u2022 Che tipo di attivazioni vedo (calde/fredde)?\n\u2022 Come si distribuiscono nello spazio 3D?\n\n\ud83c\udfaf STEP 3 - Correlazione clinica:\n\u2022 Questi pattern sono coerenti con Alzheimer?\n\u2022 Ci sono altri possibili diagnosi differenziali?\n\u2022 Qual \u00e8 il mio livello di confidenza?\n\n\ud83c\udfe5 STEP 4 - Raccomandazioni:\n\u2022 Servono ulteriori esami?\n\u2022 Quali sono i next steps?\n\nDopo questo ragionamento step-by-step, fornisci l'analisi finale:\n\nStai analizzando uno screenshot che contiene 3 slice MRI cerebrali con sovrapposizione Grad-CAM per rilevazione Alzheimer.\n\nIMPORTANTE: Analizza l'IMMAGINE REALE che vedi, non ripetere le istruzioni.\n\n\ud83e\udd16 PREDIZIONE MODELLO AI:\n\u2022 Classe predetta: Patologia rilevata (possibile MCI o AD)\n\u2022 Valore numerico: 1\n\u2022 Data predizione: 2025-07-06T09:55:06.501221Z\n\u2022 ID paziente: 40a7bc47-e0ca-41ec-bb17-467957548be0\n\n\ud83d\udcca METRICHE DEL MODELLO:\n\u2022 Accuracy: 100.0% (precisione generale)\n\u2022 Precision: 100.0% (quando predice positivo, quanto \u00e8 accurato)\n\u2022 Recall: 100.0% (quanti casi positivi cattura)\n\u2022 F1 Score: 100.0% (bilanciamento precision/recall)\n\nContesto tecnico:\n- L'immagine mostra 3 sezioni ortogonali del cervello:\n    \u2022 Sagittale (x-axis, coordinata X=64): visione laterale del cervello, utile per analizzare strutture profonde come ippocampo e corpo calloso\n    \u2022 Coronale (y-axis, coordinata Y=64): visione frontale, cruciale per confrontare emisferi destro/sinistro e osservare simmetrie\n    \u2022 Assiale (z-axis, coordinata Z=25): visione dall'alto/inferiore, utile per identificare distribuzioni corticali\n- Rosso/caldo = alta attivazione del modello\n- Blu/freddo = bassa attivazione\n\nFornisci la tua analisi seguendo ESATTAMENTE questa struttura:\n\n\ud83e\udde0 Primary Findings:\n\u2022 Descrivi quello che vedi effettivamente in ciascuna delle 3 slice\n\u2022 Specifica colori, intensit\u00e0 e posizione anatomica precisa\n\u2022 Nota differenze significative tra le slice\n\n\ud83d\udd2c Alzheimer's Indicators:\n\u2022 Le attivazioni interessano ippocampo, corteccia entorinale, o aree tipiche AD?\n\u2022 Il pattern \u00e8 coerente con neurodegenerazione?\n\u2022 Ci sono asimmetrie tra emisferi? In quale piano?\n\u2022 Come si allinea l'analisi visiva con la predizione del modello AI?\n\n\ud83d\udcc8 Confidence Level:\n\u2022 Alto/Medio/Basso - Spiega basandoti su chiarezza dell'immagine e pattern\n\u2022 Considera anche l'affidabilit\u00e0 delle metriche del modello AI\n\n\ud83d\udccc Recommended Actions:\n\u2022 Altre slice necessarie? Specifica asse e coordinate\n\u2022 Esami clinici aggiuntivi suggeriti\n\u2022 Prossimi step diagnostici\n\nDescrivi solo quello che vedi realmente nell'immagine.\nFindings:\nSagittal (x) slices with Grad-CAM overlay:\nThe sagittal slice shows a high activation in the hippocampus region, with a reddish hue. The activation extends towards the entorhinal cortex, appearing as a warm, reddish area. The activation is more prominent on the left side.\n\nCoronal (y) slices with Grad-CAM overlay:\nThe coronal slice displays a strong activation in the entorhinal cortex, with a reddish color. The activation is more pronounced on the left side, extending towards the temporal lobe. The activation is less intense in the right hemisphere.\n\nAxial (z) slices with Grad-CAM overlay:\nThe axial slice shows a significant activation in the temporal lobe, with a reddish hue. The activation is more prominent on the left side, extending towards the amygdala. The activation is less intense in the right hemisphere.\n\nAlzheimer's Indicators:\nThe activation in the hippocampus, entorhinal cortex, and temporal lobe is suggestive of Alzheimer's disease. The pattern of activation is more pronounced on the left side, which could indicate a left-sided pathology. The asymmetry between the two hemispheres is also a potential indicator of Alzheimer's disease.\n\nConfidence Level:\nHigh - The activation patterns are consistent with Alzheimer's disease, and the model AI predicts a high probability of the disease.\n\nRecommended Actions:\nFurther slices are needed to confirm the findings. Specifically, additional slices should be acquired in the sagittal and coronal planes, with a focus on the hippocampus and entorhinal cortex. Additional clinical evaluation is also recommended to assess the patient's cognitive function and rule out other potential causes of the symptoms.\n\n```\n\ud83e\udde0 Primary Findings:\nSagittal (x) slices with Grad-CAM overlay:\nThe sagittal slice shows a high activation in the hippocampus region, with a reddish hue. The activation extends towards the entorhinal cortex, appearing as a warm, reddish area. The activation is more prominent on the left side.\n\nCoronal (y) slices with Grad-CAM overlay:\nThe coronal slice displays a strong activation in the entorhinal cortex, with a reddish color. The activation is more pronounced on the left side, extending towards the temporal lobe. The activation is less intense in the right hemisphere.\n\nAxial (z) slices with Grad-CAM overlay:\nThe axial slice shows a significant activation in the temporal lobe, with a reddish hue. The activation is more prominent on the left side, extending towards the amygdala. The activation is less intense in the right hemisphere.\n\n\ud83d\udd2c Alzheimer's Indicators:\nThe activation in the hippocampus, entorhinal cortex, and temporal lobe is suggestive of Alzheimer's disease. The pattern of activation is more pronounced on the left side, which could indicate a left-sided pathology. The asymmetry between the two hemispheres is also a potential indicator of Alzheimer's disease.\n\n\ud83d\udcc8 Confidence Level:\nHigh - The activation patterns are consistent with Alzheimer's disease, and the model AI predicts a high probability of the disease.\n\n\ud83d\udccc Recommended Actions:\nFurther slices are needed to confirm the findings. Specifically, additional slices should be acquired in the sagittal and coronal planes, with a focus on the hippocampus and entorhinal cortex. Additional clinical evaluation is also recommended to assess the patient's cognitive function and rule out other potential causes of the symptoms.\n```\n```\n\ud83e\udde0 Primary Findings:\nSagittal (x) slices with Grad-CAM overlay:\nThe sagittal slice shows a high activation in the hippocampus region, with a reddish hue. The activation extends towards the entorhinal cortex, appearing as a warm, reddish area. The activation is more prominent on the left side.\n\nCoronal (y) slices with Grad-CAM overlay:\nThe coronal slice displays a strong activation in the entorhinal cortex, with a reddish color. The activation is more pronounced on the left side, extending towards the temporal lobe. The"], "consistency_score": {"score": 88, "details": {"confidence_consistency": "100.0% (Alto)", "stage_consistency": "100.0% (AD)", "region_consistency": "72.2%", "pattern_consistency": "75.0%"}, "raw_data": {"confidence_levels": ["Alto", "Alto", "Alto"], "disease_stages": ["AD", "AD", "AD"], "alzheimer_indicators": ["alzheimer", "neurodegenerazione", "AD", "alzheimer", "neurodegenerazione", "AD", "alzheimer", "neurodegenerazione", "AD"], "key_regions": ["ippocampo", "hippocampus", "corteccia", "cortex", "temporal", "entorinale", "ippocampo", "hippocampus", "corteccia", "cortex", "temporal", "entorinale", "ippocampo", "hippocampus", "corteccia", "cortex", "temporal", "entorinale"], "activation_patterns": ["red", "red", "red", "high activation"]}}, "final_quality_score": 280, "n_runs": 3, "cot_prompt_used": "\n\ud83e\udde0 ANALISI STEP-BY-STEP (Chain of Thought):\n\nPrima di fornire la tua analisi finale, ragiona step-by-step:\n\n\ud83d\udd0d STEP 1 - Osservazione iniziale:\n\u2022 Cosa vedo prima di tutto nell'immagine?\n\u2022 Quante slice sono presenti e dove sono posizionate?\n\u2022 Quali sono i colori dominanti in ogni slice?\n\n\ud83d\udd2c STEP 2 - Analisi tecnica:\n\u2022 Quali regioni anatomiche sono coinvolte?\n\u2022 Che tipo di attivazioni vedo (calde/fredde)?\n\u2022 Come si distribuiscono nello spazio 3D?\n\n\ud83c\udfaf STEP 3 - Correlazione clinica:\n\u2022 Questi pattern sono coerenti con Alzheimer?\n\u2022 Ci sono altri possibili diagnosi differenziali?\n\u2022 Qual \u00e8 il mio livello di confidenza?\n\n\ud83c\udfe5 STEP 4 - Raccomandazioni:\n\u2022 Servono ulteriori esami?\n\u2022 Quali sono i next steps?\n\nDopo questo ragionamento step-by-step, fornisci l'analisi finale:\n\nStai analizzando uno screenshot che contiene 3 slice MRI cerebrali con sovrapposizione Grad-CAM per rilevazione Alzheimer.\n\nIMPORTANTE: Analizza l'IMMAGINE REALE che vedi, non ripetere le istruzioni.\n\n\ud83e\udd16 PREDIZIONE MODELLO AI:\n\u2022 Classe predetta: Patologia rilevata (possibile MCI o AD)\n\u2022 Valore numerico: 1\n\u2022 Data predizione: 2025-07-06T09:55:06.501221Z\n\u2022 ID paziente: 40a7bc47-e0ca-41ec-bb17-467957548be0\n\n\ud83d\udcca METRICHE DEL MODELLO:\n\u2022 Accuracy: 100.0% (precisione generale)\n\u2022 Precision: 100.0% (quando predice positivo, quanto \u00e8 accurato)\n\u2022 Recall: 100.0% (quanti casi positivi cattura)\n\u2022 F1 Score: 100.0% (bilanciamento precision/recall)\n\nContesto tecnico:\n- L'immagine mostra 3 sezioni ortogonali del cervello:\n    \u2022 Sagittale (x-axis, coordinata X=64): visione laterale del cervello, utile per analizzare strutture profonde come ippocampo e corpo calloso\n    \u2022 Coronale (y-axis, coordinata Y=64): visione frontale, cruciale per confrontare emisferi destro/sinistro e osservare simmetrie\n    \u2022 Assiale (z-axis, coordinata Z=25): visione dall'alto/inferiore, utile per identificare distribuzioni corticali\n- Rosso/caldo = alta attivazione del modello\n- Blu/freddo = bassa attivazione\n\nFornisci la tua analisi seguendo ESATTAMENTE questa struttura:\n\n\ud83e\udde0 Primary Findings:\n\u2022 Descrivi quello che vedi effettivamente in ciascuna delle 3 slice\n\u2022 Specifica colori, intensit\u00e0 e posizione anatomica precisa\n\u2022 Nota differenze significative tra le slice\n\n\ud83d\udd2c Alzheimer's Indicators:\n\u2022 Le attivazioni interessano ippocampo, corteccia entorinale, o aree tipiche AD?\n\u2022 Il pattern \u00e8 coerente con neurodegenerazione?\n\u2022 Ci sono asimmetrie tra emisferi? In quale piano?\n\u2022 Come si allinea l'analisi visiva con la predizione del modello AI?\n\n\ud83d\udcc8 Confidence Level:\n\u2022 Alto/Medio/Basso - Spiega basandoti su chiarezza dell'immagine e pattern\n\u2022 Considera anche l'affidabilit\u00e0 delle metriche del modello AI\n\n\ud83d\udccc Recommended Actions:\n\u2022 Altre slice necessarie? Specifica asse e coordinate\n\u2022 Esami clinici aggiuntivi suggeriti\n\u2022 Prossimi step diagnostici\n\nDescrivi solo quello che vedi realmente nell'immagine."}
}
